{
  "schema_version": "content-layer-mvp-v1",
  "project_id": "sample_corner_noodle_reference",
  "created_at": "2026-07-09T00:00:00+08:00",
  "source_files": {
    "voiceover_script": "content/voiceover_script.json",
    "subtitle_track": "subtitles/subtitle_track.json",
    "jianying_manifest": "jianying_manifest/manifest.plan.json"
  },
  "audio_policy": {
    "voiceover_is_primary_clock": true,
    "libtv_audio_default_policy": "mute",
    "real_footage_audio_policy": "manual_review_required",
    "no_tts_generated_in_mvp": true
  },
  "tracks": {
    "voiceover": {
      "enabled": false,
      "source": null,
      "gain_db": 0,
      "pan": 0,
      "status": "pending",
      "notes": "No TTS generated in sample."
    },
    "background_music": {
      "enabled": false,
      "source": null,
      "gain_db": -18,
      "pan": 0,
      "status": "pending",
      "notes": "Optional only after review."
    },
    "original_audio": {
      "enabled": false,
      "source": null,
      "gain_db": -99,
      "pan": 0,
      "status": "muted",
      "notes": "No original media included."
    },
    "sfx": {
      "enabled": false,
      "source": null,
      "gain_db": 0,
      "pan": 0,
      "status": "pending",
      "notes": "No effects in sample."
    }
  },
  "ducking": {
    "enabled": false,
    "music_gain_when_voice_db": -12,
    "attack_ms": 120,
    "release_ms": 240
  },
  "loudness_target": {
    "integrated_lufs": -16,
    "true_peak_db": -1
  },
  "export_targets": [
    "preview_mp4",
    "jianying_draft"
  ]
}
